{
  "schema_version": 1,
  "skill": "arrival-engineering",
  "source_kind": "owner-design-brief",
  "repository": null,
  "commit": null,
  "source_path": "intake/arrival-engineering/SOURCE_PROPOSAL.md",
  "locked_files": [
    {
      "path": "intake/arrival-engineering/SOURCE_PROPOSAL.md",
      "sha256": "1570c6302bb99843bfd370698bfe894643b00a9ccb800469c129cb2d23e1b4ea"
    }
  ],
  "method_references": [
    {
      "repository": "cursor/plugins",
      "path": "pstack/skills/create-verification-skill/SKILL.md",
      "commit": "b9ddc83c32972210b8a94d389130713e8eed346e",
      "blob_sha": "f869e26122991252373d5b8f6357e5b9ff195a00"
    },
    {
      "repository": "cursor/plugins",
      "path": "pstack/skills/maintain-verification-skill/SKILL.md",
      "commit": "b9ddc83c32972210b8a94d389130713e8eed346e",
      "blob_sha": "a2680b91fead45a0b4963d8c367a854956bea59d"
    }
  ]
}
