{
  "schema_version": 1,
  "skill": "red-team",
  "source_kind": "owner-design-brief",
  "repository": null,
  "commit": null,
  "source_path": "intake/red-team/SOURCE_PROPOSAL.md",
  "locked_files": [
    {
      "path": "intake/red-team/SOURCE_PROPOSAL.md",
      "sha256": "c3e503cce176f1d67ed89e3cc8c49f048875bd22f1de6b4688d88c5bbc15021e"
    }
  ],
  "method_references": [
    {
      "repository": "cursor/plugins",
      "path": "pstack/skills/create-verification-skill/SKILL.md",
      "commit": "b9ddc83c32972210b8a94d389130713e8eed346e",
      "blob_sha": "f869e26122991252373d5b8f6357e5b9ff195a00"
    },
    {
      "repository": "cursor/plugins",
      "path": "pstack/skills/maintain-verification-skill/SKILL.md",
      "commit": "b9ddc83c32972210b8a94d389130713e8eed346e",
      "blob_sha": "a2680b91fead45a0b4963d8c367a854956bea59d"
    }
  ]
}
